{"name":"gemstone-py-native adapter contract","contractVersion":1,"threading":"session is synchronous and non-Send/non-Sync; PyO3 wrappers should use unsendable classes or dedicated worker threads","operations":["login","logout","eval","eval_oop","execute","resolve","value_to_oop","perform","new_string","new_symbol","fetch_string","global_get","global_put","commit","abort","needs_commit","in_transaction","add_to_export_set","remove_from_export_set"],"valueKinds":["nil","bool","smallInt","char","string","symbol","oop"],"errorKinds":["gci","missingEnvironment","missingConfig","nul","notLoggedIn","gemStone","illegalOop","unexpectedType","mapping","workerStopped","workerPanicked","negativeSize","argumentCountTooLarge"],"oopConstants":{"nil":20,"true":268,"false":12,"smallint7":58,"charA":16668}}
